Date,Name,Score,Title,Content
2020-01-29,nooeh,0,Les Wexner considering selling Victoria's Secret,"Who do you think are potential buyers? Can the brand be turned around?

https://www.wsj.com/articles/victorias-secret-billionaire-in-talks-to-step-aside-and-sell-brand-11580299200

""Leslie Wexner, the billionaire behind Victoria’s Secret, is in discussions to step aside as chief executive officer of his retail empire and is exploring strategic alternatives for the lingerie brand, according to people familiar with the matter.

The discussions are ongoing and could result in a full or partial sale of Victoria’s Secret, some of the people said. The chain, with about $7 billion in annual sales, has long dominated the U.S. lingerie market but has struggled in recent years with falling sales. The company is looking to reach a decision on the potential deal and succession plans in coming weeks, they said, though there is no guarantee it will reach an agreement.

Mr. Wexner, 82 years old, who built Abercrombie & Fitch, The Limited and Victoria’s Secret into national chains, is the longest-serving CEO of an S&P 500 company. He would be handing over the job after a difficult stretch for the business he has run for 57 years. He could continue in his role as chairman, one of the people said.

[L-brands performance vs S&P 500](https://i.imgur.com/pTYW23Q.png)

Shares of Victoria’s Secret parent company L Brands Inc. dropped 29% last year, missing out on a broad stock market rally. The company, which also owns the Bath & Body Works and Pink chains, has a market value below $6 billion, down from $29 billion at its peak in 2015.

Last year, the New York activist hedge fund Barington Capital Group LP built a small stake in L Brands and urged the company to consider splitting the fast-growing Bath & Body Works chain from Victoria’s Secret. L Brands added two new directors and signed an agreement with Barington to have the fund serve as a special adviser.

Mr. Wexner has run the business since 1963 and took it public in 1969. From a small store in Columbus, Ohio, he built a retail empire by upending the department store model and developing specialty mall brands. He is the company’s biggest shareholder, with a roughly 17% stake, according to the latest proxy filing.

Last year the reclusive Ohio billionaire drew attention for his association with the late financier Jeffrey Epstein, who for nearly two decades managed Mr. Wexner’s wealth. Mr. Epstein was indicted last summer on federal sex-trafficking charges stemming from an alleged scheme to exploit underage girls. Mr. Epstein died in August while in a New York City prison awaiting trial.

Mr. Epstein supervised Mr. Wexner’s personal investments, bought one of the company’s jets and took a role in the retail business, sometimes trying to offer input on which women should be Victoria’s Secret models, The Wall Street Journal has reported. Mr. Wexner has said that he didn’t know about Mr. Epstein’s alleged criminal behavior and that he ended their relationship more than 10 years ago.

A few days before Mr. Epstein’s death, Mr. Wexner sent a letter to members of his Wexner Foundation accusing Mr. Epstein of misappropriating large sums of his wealth. “I know now that my trust in him was grossly misplaced, and I deeply regret having ever crossed his path,” he wrote in the letter.

The reports of ties between Mr. Epstein and L Brands prompted the company to re-examine Mr. Epstein’s involvement. L Brands’ board hired an outside law firm in July 2019 to investigate what role he played at the company. The results of the investigation haven’t been made public.

Over the years, Mr. Wexner sold off many of the clothing brands he helped create, but held on to his bra-and-beauty businesses, including Victoria’s Secret.

In the mid-1990s, the brand’s heavily padded Miracle Bra, designed to create cleavage, was vying for market share with Sara Lee Corp.’s Wonderbra. Victoria’s Secret doubled down on ads with provocative TV commercials and theatrical fashion shows. In 2004, it launched Pink, a brand aimed at teens and preteens.

In 2016, Mr. Wexner parted ways with the CEO of Victoria’s Secret and assumed direct control of the business. The company warned sales would drop as Mr. Wexner made changes. He eliminated swimwear and shifted away from catalog mailings, but kept hundreds of stores in malls.

As retail bankruptcies were piling up in 2017, he defended his strategy in an interview with the Journal. People crave social interaction and will seek it at places like malls, he said. “I’ve got 5,000 years of history on my side,” pointing to the ancient shopping bazaars in Rome and Istanbul.

Demand for Victoria’s Secret bras continued to cool as customers turned to brands emphasizing comfort and inclusivity. In 2018, Mr. Wexner reversed some of his earlier decisions—re-entering swimwear and mailing out catalogs again.

Last year the company eliminated its televised fashion show and replaced its longtime marketing chief, Edward Razek, who had been instrumental in pushing its overtly sexy marketing. Comparable sales of Victoria’s Secret fell 12% during the holiday period, extending their slide."""
2019-09-20,idreamofkitty,258,Dying Words of T Boone Pickens,"Thomas Boone Pickens Jr. (May 22, 1928 – September 11, 2019) was an American business magnate and financier. Pickens chaired the hedge fund BP Capital Management. He was a well-known takeover operator and corporate raider during the 1980s. As of November 2016, Pickens had a net worth of $500 million.

Before his death, Pickens wrote his last words to be published on LinkedIn by his foundation after he passed.

The entire post is much longer, but below is the key excerpt. In it, Pickens lists his secrets to success and building wealth:

– A good work ethic is critical.

– Don’t think competition is bad, but play by the rules. I loved to compete and win. I never wanted the other guy to do badly; I just wanted to do a little better than he did.

– Learn to analyze well. Assess the risks and the prospective rewards, and keep it simple.

– Be willing to make decisions. That’s the most important quality in a good leader: Avoid the “Ready-aim-aim-aim-aim” syndrome. You have to be willing to fire.

– Learn from mistakes. That’s not just a cliché. I sure made my share. Remember the doors that smashed your fingers the first time and be more careful the next trip through.

– Be humble. I always believed the higher a monkey climbs in the tree, the more people below can see his ass. You don’t have to be that monkey.

– Don’t look to government to solve problems — the strength of this country is in its people.

– Stay fit. You don’t want to get old and feel bad. You’ll also get a lot more accomplished and feel better about yourself if you stay fit. I didn’t make it to 91 by neglecting my health.

– Embrace change. Although older people are generally threatened by change, young people loved me because I embraced change rather than running from it. Change creates opportunity.

– Have faith, both in spiritual matters and in humanity, and in yourself. That faith will see you through the dark times we all navigate.

Sauce: [DumbWealth](http://www.dumbwealth.com)"
2019-12-30,grammerknewzi,2,Global macro,"Hello I’m currently a undergrad majoring in finance. I would like my end goal to be buy side, hopefully in a hedge fund. My investing style is more global macro. I only currently know of Bridgewater as the main face of such tactics, but they are apparently known to have a terrible work culture. Could anyone help list other such funds which deploy similar tactics?"
2020-01-08,atlantaoonana,0,Noob investor: Do you pay taxes on the principal amount you put in when you sell if you realized losses?,"My father had a stroke and I am trying to understand his account as well as mine (he invested for me. My portfolio has about 10 stocks. 

The losses in some are unreal, but I have been told that when my father switched from his old broker to TD ameritrade **the purchase prices do get messed up and can lead to inaccurate representations of original purchase price?**

&#x200B;

Anyway, my uncle who owns a hedge fund wants me to sell all I have (I have about 110-120 K depending on the day) in my portfolio, and put it in the SP500 and BRK.B. This makes some sense because from what TD ameritrade is showing me, dad has only made losses on my account, and over a few years the other two seem to have decent returns.

**Would I be paying taxes on the liquidation of the account if my sell price is less than the purchase price?**

Additionally, I dont know why he held onto some stocks (dad isn't stupid), is there a way to look at market trends and try to figure out why he was holding onto certain stocks (MNK for example?)

I included a snapshot of my portfolio if it helps. I am very very new to this and any advice is appreciated"
2019-08-23,grittygatorr,151,Serious: What does a quant trader/statistician/mathematician exactly do while trading?,"(Posted earlier on [r/algotrading](https://www.reddit.com/r/algotrading/))

Hey Traders!

The question pretty much sums it all. I am a semi-professional futures trader (CL, ZT, ZS, some crypto), who uses basic technical indicators since two years and has been fairly profitable.

That said, I don't understand the rush towards all things maths and statistics as a basic requirement to trade - if hedge fund and prop trading positions are considered.

So here's my humble question - where exactly does complex math, statistical model making, and computer programming come into the picture? Software dev positions are explanatory, but where do the aforementioned help? Doesn't the first rule of markets say you can't predict prices and movements?

Or is everyone rushing towards complex solutions which could have been solved fairly easily?

Worse still - are talks of ML, RL, AI, algo, etc a ""gimmick"" to attract investor capital?

All thoughts would be very, very helpful.

PS - Don't make this a discussion about TA vs Quant. I do use indicators to trade, but definitely, don't draw discretionary trend lines or watch ""heads and shoulders"" or analyze moon phases to place trades. In fact, I do think TA is complete bull, but using indicators has its logical reasons.

**Edit 1** \- Terrific answers, y'all. I am sure many others would be pleased over these insights.

**Edit 2** \- Here's an outline about how I trade. Mentioned it in one of the comments below but I guess it makes a good add-on to the passage:

As an economics graduate, I understand the most widely used macro-economic models and can construct most models used by mutual funds or I-banks. However, the use of ""complex"" math and Ph.D. degrees as a prerequisite to trade profitably goes right above me.

For example - while trading the soybean oil futures (ZL) market, I look at any directly affecting news variables or major import/export law changes or drastic macro climate changes that would impact ZL prices. I then form a hypothesis of which side (long/short) to take *more* exposure in, check basic moving averages, check soybean futures (they kinda *lead oil* prices indicator-wise) and depending on my screen availability, either trade aggressively or place a couple of contracts and walk away. Each contract costs me $490, each hundredth of a tick movement is worth $6, so a brief move nets me $300-$500 if I trade 6-7 contracts. Some days the market goes crazy and it equates to over a thousand dollars in profits, and it almost never does crazy reversals that I end up taking on a huge loss. For futures like NQ that are absolute beasts in terms of volatility and movement, a few contracts can easily net a few grand if the market goes ballistic (trump tweets, trade war updates, etc).

I guess my point is, this basic idea of how I trade gives me respectable profits - leaving me pondering for the need for a math or physics Ph.D. to trade markets profitably. However, generally knowing what they do greatly helps me appreciate the quant trading sector, and leaves a good impression of how I must not get comfortable with my strategy and look towards including more advanced concepts to ensure I don't end up crying my way to the morgue."
2019-11-19,MasterCookSwag,24,Matt Levine offers some really interesting commentary on borderline fraudulent letters submitted to the SEC regarding the recent corporate proxy changes.,"If you're not subscribed you can get these straight to your inbox daily by going to Matt Levine's bloomberg page.  It's a pretty solid daily read on financial happenings/occasional fuckery and what not.  This one in particular I thought Y'all might enjoy given the recent buzz over proxy advisor changes.  It comes via email so I'll paste below but this should also be on Levine's daily articles on bloomberg. 

**Don’t read the comments**

Most debates over financial regulation are, in an obvious first-order sense, about whether regulation should favor one group of rich powerful financial professionals, or another group. Corporate governance disputes, for instance, basically come down to whether corporate chief executive officers should have more control of their companies, or whether instead more control should go to hedge fund managers and the executives of big asset management companies. This is a problem because regulators can’t really make rules on this basis. They can’t be like “we’ve heard that some CEOs’ feelings are hurt when hedge fund managers criticize their multimillion-dollar paychecks, so we’re changing the rules to be nicer to the CEOs.”


They don’t have to, though, because this is only true in an obvious first-order sense. In fact the CEOs and the hedge fund managers are just representatives of broader groups and more important principles. The hedge fund managers will tell you that they invest the pension money of ordinary people, and that anyway they are advocating for more power for ordinary investors. The CEOs will tell you that they just want to be able to make long-term decisions for the good of their companies in a way that will preserve ordinary people’s jobs and savings. And then if the regulators make a rule favoring the CEOs they can talk about the ordinary workers they’re protecting, and if they make a rule favoring the hedge fund managers they can talk about the ordinary investors they’re protecting, and it is all much more palatable than if you just talk about the CEOs and the hedge fund managers, and also it is basically true. It’s not like the CEOs and the hedge fund managers are fighting each other in a closed ecosystem; the balance of power between them does matter, in an indirect but real way, for everyone else.


It can all feel pretty abstract, though. It’s all well and good to say that you’re representing ordinary people, but it’s better to show it. Ideally what you want is for some ordinary people to write letters to the regulators saying “actually you should favor corporate CEOs over hedge fund managers because of my retirement savings,” or whatever. It can be hard to find ordinary people who actually think that, though, or who have paid enough attention to the issue to write those letters; it feels pretty abstract to them too!


So the next-best choice is to imagine what ordinary people would say if they actually supported your side, and then write that down. Write an imaginary letter on behalf of an imaginary ordinary person, urging the regulator to take the side that favors CEOs or hedge fund managers, whichever side you’re on.
And then once you’ve written that letter just find a real ordinary person and ask her to sign it, whatever, who cares, it’s just a letter, who is going to check.


Bloomberg’s Zachary Mider and Ben Elgin checked:

>When Securities and Exchange Commission Chairman Jay Clayton handed a policy win to corporate executives this month, he pointed to a surprising source of support: a mailbag full of encouragement from ordinary Americans.
>To hear Clayton tell it, these folks are really focused on the intricacies of the corporate shareholder-voting process. “Some of the letters that struck me the most,” he said at a commission meeting in Washington, “came from long-term Main Street investors, including an Army veteran and a Marine veteran, a police officer, a retired teacher, a public servant, a single mom, a couple of retirees who saved for retirement.” Each bolstered Clayton’s case for limiting the power of dissenting shareholders.
But a close look at the seven letters Clayton highlighted, and about two dozen others submitted to the SEC by supposedly regular people, shows they are the product of a misleading -- and laughably clumsy -- public relations campaign by corporate interests.
That retired teacher? Pauline Yee said she never wrote a letter, although the signature was hers. … “I never wrote a letter,” said one of the retirees, Vytautas Alksninis, reached by phone at his home in Connecticut. “What’s this all about?”
>Then there’s the public servant Clayton mentioned. … She said the letter originated with a public-affairs firm that contacted her out of the blue.
“They wrote it, and I allowed them to use my name after I read it,” she said. “I didn’t go digging into all of this.”

What is particularly bad here is that “at least 20” of the fake letters contain “an out-of-context phrase inserted into the SEC’s mailing address”: If you’re writing a letter to the SEC, you put the SEC’s address at the top just for old time’s sake (of course you don’t mail it, you just submit it online), and for some reason the person mass-writing these letters inserted the phrase “A Coalition of Growth Companies” into the address that he or she cut and pasted into all the fake letters. Oops!
The specific debate here is about the regulation of proxy advisers; we have talked about it a couple of times before. Basically there are companies called proxy advisers that tell investment managers how to vote on corporate matters, and sometimes they tell the investment managers to vote against corporate management, and the managers don’t like that so they’ve asked the SEC to regulate the advisers more. They can’t just come out and say that, so instead the argument is that the proxy advisers, and the big investment funds who rely on them, might have political and social and governance and power agendas that conflict with the interests of the individual humans whose retirement savings are invested in those funds—that people’s savings are “being steered by third parties to promote individual agendas, rather than to further their primary goals of being able to have enough money,” as Clayton said in the next sentence of his statement.


You can just say that, and people do, and it has a certain truth to it; there are real conflicts between the interests of investment managers (and proxy advisers) and those of their ultimate investors. But it’s better if you can find an 83-year-old Army veteran to say “how disgusted I am that my financial investments are being used as a political pawn,” or a retired Marine veteran” to say “I didn’t invest my money to have others make any kind of political statement. I invested my money to be able to leave something for my children and grandchildren in order to make their lives a little better,” or a hard-working single mother to say “Let the folks who work at proxy advisory firms bring about social change on their dime, not mine,” or a retiree to say “Call me naïve but I certainly didn’t sign up for groups with their own agenda voting my proxy!”


Obviously you can’t find people to say that, because no normal human actually pays attention to or cares about any of this. But if you work on one side of the issue, you can convince yourself that normal people should care about it, and then you can imagine what they might say if they did care, and then you can write it down, and then as a final, only-somewhat-fraudulent step, you can go find an ordinary person to sign the letter you wrote. Perhaps you can even give them a brief summary of the issue, and let them read the letter they’re signing, and get them to care about it enough to agree with you for five minutes before they forget all about it.


The thing is the letters are fine! Whoever wrote them mostly did a good job of imagining how an SEC chairman, or a financial columnist for that matter, would imagine how an 83-year-old Army veteran would think about proxy advisers if he bothered to think about proxy advisers. As works of fiction they have a certain verisimilitude.


Of course it is gross to find out that they are fictional, and that the SEC is citing the support of “Main Street investors” who do not actually support the regulation, but you should not kid yourself that it matters. The SEC isn’t changing the rules because it believes that that’s what Main Street investors want; it’s changing the rules because it believes that that’s what Main Street investors would want, if they paid attention to any of this. The SEC, and the people actually writing the letters, agree that this change is in the interests of ordinary investors and is the sort of thing that ordinary investors would want. It just feels more concrete if they can point to a ordinary investor who does want it.
The obvious solution here is to explicitly allow fictional comment letters. Of course the SEC already allows fictional comment letters, in the sense that it doesn’t seem to do any identity checking, and we have talked before about how lots of comment letters are blatantly fictitious. Many fictitious comment letters seem to be submitted for the sake of numbers: It is nice to say “a hundred ordinary investors wrote in to support this,” or whatever, but that’s rarely true and should not be taken seriously. But other fictitious letters are like these letters; they are submitted for the sake of their argument, and for a certain ordinary-investor flavor that comes from a talented writer of fiction trying to channel what he thinks an ordinary investor would actually feel and say. Why not let those fiction writers practice openly? Why not submit a letter from like the Coalition of Giant Company CEOs saying “as CEOs, we like this rule, but we also think it’s in the interests of ordinary investors, and to give you a sense of that here’s what we imagine an 83-year-old Army veteran might hypothetically have to say about it.” And then you write the fake letter, and the SEC can say “we too can easily imagine that an elderly veteran might say ‘how disgusted I am that my financial investments are being used as a political pawn,’” etc. etc. etc., it loses almost none of its rhetorical effect for being fake. Just admit that it’s all fake!


Elsewhere in the proxy-adviser debate, billionaire hedge fund manager Carl Icahn wrote a pro-hedge-fund-manager argument under his own name and published it in the Wall Street Journal. Fair!"
2019-09-07,ExtremeEducation,0,Index Bubble?,"I just read this article about Michael Burry, warning that Index ETFs are a bubble:  
[https://marketrealist.com/2019/09/market-crash-due-to-etfs-burry-weighs-in/](https://marketrealist.com/2019/09/market-crash-due-to-etfs-burry-weighs-in/)

I'm a big believer in index funds as the strategy is so simple and it enables me to leapfrog and protect myself from all kind of shady financial products.

Buffett got me on the index train. He openly recommended to buy indexes and the logic is simple: Basically any other investment will underperform the S&P 500 over time, e.g. WallSteet funds are charging exorbitant fees to manage money plus they underperform the index. He made the famous bet that the S&P will outperform hedge funds and he won. So why would anybody buy mutual funds or try to pick stocks if he will underperform anyway?

I absolutely see Michael Burry's point. So many people are on the index train, they just buy it with complete disregard of the underlying asset value.

And I can see how this could lead to a bubble.

Thoughts?"
2019-12-10,mateoverano,2,"Actual Returns of Pure Alpha, All Weather, ...?","Is there any way to find out the actual returns of Pure Alpha, All Weather, and/or other hedge funds?  I see various articles throwing around numbers, but they often quote different returns for the same fund.   E.g. I see Pure Alpha returned 3.4% in 2013, 2.4% in 2014, 3.3% in  2015, 2.0% in 2016, and 1.2% in 2017 in one article, but then others show just select years from this bunch with numbers as different as +/- 2%."
2019-12-29,nerraw888,1,book search: risk management,"Can anyone recommend a book on risk management(related to investing)?

I'd strongly prefer if the author is more into fundamentals, actual tangible values and logic. (sorry technical traders)

I'm interested in risk management that can be quantified if possible, e.g. protective puts., possibly touch on hedge fund strategies, but I have a feeling a lot of that is hocus pocus or insider trading."
2019-10-28,van2z,5,What investment opportunities open up once you have a million dollars?,"I've always heard, the more money you have, the easier it is to make more money. 

My question is this: are there investments you can make, that are lower risk, *and* higher return, than standard investments, that most people usually don't go for simply because you need to put a lot of money down?

The only investment that I've heard of with that description has been hedge fund, and maybe also real estate. Assume the investor doesn't care to actively manage the account.

Do you know of any other examples?"
