Date,Name,Score,Title,Content
2020-02-11,brownck,21,A 50-50 stock/bond allocation starting back in 2007-2008 gives slightly better returns today than a pure stock portfolio with significantly less volatility,"Just for those who think we are nearing a recession, re-allocating to a 50-50 bond and stock split 1-2 years before the recession would provide a hedge against volatility but still produces comparable gains similar to an all stock fund. See the results for yourself:

[50-50 bond/stock fund returns from 2008-now](https://www.portfoliovisualizer.com/backtest-portfolio?s=y&timePeriod=4&startYear=2008&firstMonth=1&endYear=2020&lastMonth=12&calendarAligned=true&initialAmount=100000&annualOperation=0&annualAdjustment=0&inflationAdjusted=true&annualPercentage=0.0&frequency=4&rebalanceType=1&absoluteDeviation=5.0&relativeDeviation=25.0&showYield=false&reinvestDividends=true&benchmark=VFINX&symbol1=IVV&allocation1_1=50&symbol2=IEF&symbol3=TLT&allocation3_1=50&symbol4=GLD&allocation4_1=0&symbol5=CASHX&allocation5_1=0)

**Some key takeaways (50-50 vs all stock):**

Max drawdown (fall from peak) is -17% vs -48%

Worst year returns is -3% vs -37%

standard deviation is 8.6% vs 14.9%

Final balance (100k initial) is $291k vs $279k

Final Note: Over the long hall, e.g. from say 2003 - now, stocks win, but I thought this was interesting especially given the fact that a recession might be nearing in 1-2 years."
2020-02-06,devdevdev51,58,A detailed discussion of using futures contracts to obtain leverage; holding a long position of the S+P 500 index,"In [another post](https://www.reddit.com/r/investing/comments/eys2db/there_has_been_a_ton_of_discussion_about_leverage/), I reviewed some of the ways to obtain leverage in your portfolio. Here, I discuss futures specifically.

[Futures](https://www.investopedia.com/terms/f/futures.asp) may be the most cost-effective way of obtaining leverage, or are at least comparable to options. With index futures, you enter into a contract to buy or sell the index at a future date (NOT optional), and the notional value contract can be 5x, 50x, or 250x the underlying index (in the commonly traded CME group contracts). Depending on how much capital you commit to the margin (a sort of good faith deposit), leverage can be anywhere from almost 0x up to 25x if your margin requirement was 4%. This position can be rolled forward quarterly, and leverage will increase if the index loses value and decrease if the index gains value.

You do not earn dividends, although this is reflected in the futures price (Future Price = Spot Price \* e\^((Financing Cost – Continuous Dividend Rate)\*Time to Maturity). When interest rates are high, the exponent is positive and the futures contract trades at a premium; you can end up paying a significant amount of roll adjustment in a market in contango. When interest rates are lower than the dividend rate, the exponent is negative and you get a discount for buying a futures contract; a market in backwardation is helpful for those looking to hold a contract long-term. Note that this roll adjustment does not occur when rolling a contract forward, but rather gradually over the life of the contract.

While all that might sound complex, the effect of contango/backwardation has not been substantial over the past 20 years as a whole because interest rates have been both higher and lower than the dividend rate. Let’s say we decide to trade the [E-mini S+P 500 contract](https://www.investopedia.com/terms/e/emini.asp), where the contract size is 50x the index. If you were to enter into a futures contract in 2000 when the index value was \~$1400 and roll it quarterly, you would be forced into a margin call and essentially wiped out in 2008 with any amount of leverage >1.5x (starting balance of ≤\~$47000). If you “rescued” your account and injected enough cash to avoid margin calls, you would have had to put up \~$4500 at the worst of the recession, and turned your $47,000 into \~148,000 in December 2019. This sounds great, but if you had simply invested your initial capital plus the $4500 in an S+P 500 index fund and reinvested dividends, you would have \~$164,000 with much less risk. “Rescuing” your account when starting with higher leverage has similar results, with higher ending balances, higher “rescue” requirements, and similar returns to the S+P 500 with dividends reinvested. By the way, releveraging or hedging your account by going long or short on Micro contracts (contract value 1/10 the Emini), you would do even worse.

Of course, if you started with $47,000 in 2010 and rolled forward 2 E-mini futures contracts (2 because this results in starting leverage of 2.36x compared with 1.2x for 1 contract) until 2020, you would have ended with \~$269,000 compared with the S+P’s return of \~$165,000. So, if you could somehow time the market, leverage obviously does well.

The only way I found of consistently beating the passive index holder since 2000 was to “double down”, or invest more money AND increase your leverage by buying additional contracts every time the index drops significantly. Let’s say you decided to start at 3x leverage with \~$24,000 committed, then trade an additional contract (increasing your leverage, requiring extra money to be injected into your account to avoid margin calls) every time the index dropped to 2/3 of its starting value ($952 for our example of starting in 2000 with the index at $1429), and wait at least a year to “double down” again. You would have started trading 2 E-mini contracts after the dot-com bubble burst in 2002, 3 during the 2008 Great Recession, and maintained those 3 contracts until December 2019. You would have injected \~$36,000 (more than the value of the initial account!) and ended with a final value of \~$427,000, compared to just investing your original $24,000 + $36,000 in the S+P 500 (reinvesting dividends) and ending with \~$191,000. Of course, this requires serious resolve and access to extra cash when the economy is at its worst. My next plan is to test this strategy over many time periods.

The final consideration is taxes. If you invest in a taxable account, you will be on the hook for only the long-term capital gains tax of 15% with stocks and ETFs, and you can realize those gains at the end of your investing period. LEAPs and futures are subject to the 60/40 rule, where 60% of your gains are taxed at the long-term rate of 15% and the other 40% is taxed as short-term gains (taxed as income), and you have to do this every year (although you can tax-loss harvest).

**TL;DR Leverage results in greater gains and greater loss, but can be expensive to obtain. Options and futures are the most cost-effective way of obtaining leverage. Holding a leveraged long position with options and futures is possible, but can be completely wiped out with severe drawdowns. An aggressive futures trading strategy of increasing your leverage and cash committed every time the index loses significant value could be profitable if the value of the index increases over time.**

Does anyone here use futures to obtain leverage?

**Edit:** Some of you are misunderstanding how leverage changes over time. Here is the link to some of the data ([https://docs.google.com/spreadsheets/d/1hF1IXWXWZLZraVevnkL0oWVKuQMCQs6dXO46o8E7Zmw/edit?usp=sharing](https://docs.google.com/spreadsheets/d/1hF1IXWXWZLZraVevnkL0oWVKuQMCQs6dXO46o8E7Zmw/edit?usp=sharing)). It's easier to see with all the numbers. Let me know if you have any feedback or catch a mistake."
2020-03-26,sellside_sandy,7,Market Outlook - March 2020,"Hi guys, just want to share with you my current market outlook. Hope this can help spur a discussion for everybody's benefit. This is not a an investment advice. You are not my client and I am not your fiduciary. That said, the views below are just for discussion purposes.

At the risk of being cliche and obviously wrong, here I go:

**Short term-medium term:**

1. We are in a bear market, and recession is already underway.
2. Occasionally, there will be ""bear market rallies)"". For long term investors, these are not a time to buy **yet**, use it to sell instead. For traders, bear market rallies and the volatility that they bring, are great opportunities to make money. Dow Theory suggest there could be at least three bear market rallies within the overall bear market trend.
3. Reason why I think the downturn will continue for short-medium term: The USA is still early in the coronavirus infection blow out. Look at updated chart by JP Morgan and FT [here](https://ibb.co/tsSwJcg) and [here](https://www.ft.com/coronavirus-latest). The Fed is doing everything they can to keep liquidity/market functioning. The fiscal stimulus that the government is trying to pass, should dampen the blow to the economy. But, as long as the coronavirus situation i.e, the public healthcare crisis, the real crisis, is not tackled immediately through decisive action like other countries, then it will only prolong the infection period. See Bill Gate and WHO's opinions [here](https://www.cnbc.com/2020/03/24/bill-gates-us-missed-its-chance-to-avoid-coronavirus-shutdown.html) and [here](https://www.theglobeandmail.com/world/article-who-sees-potential-of-us-becoming-new-coronavirus-epicenter/). IMO, the market is still underestimating the coronavirus infection and the blow to the economy that it could bring given ineffective measures by the government.
4. The market could at least fall for another 15% before it starts to find a bottom based on previous bear markets.

**Longer term:**

1. Stocks would eventually go into bull market again.
2. Among the indicators that signal bottoming/reversal would be volatility (VIX) returning to normal level.
3. High quality companies, I would imagine mega-tech with pristine balance sheet, would rally first and perhaps perform the best in the upcoming bull market.

**Asset Allocation**

***Short term***: Short equity via inverse ETF, short emerging market stock/currency - especially countries with twin deficits (fiscal and trade), long gold, long treasury. Or just stay in cash.

***Risks:*** As what happened previously, gold and treasury did not provide the hedging characteristics. They went down together with stocks, while in normal condition, it they should go up. One possible explanation is that funds are liquidating any positions that they could, to satisfy redemption and margin call.

***Things to avoid: 1)*** **Options**, because options are currently trading at premium in general due to high implied volatility. Also remember that with options, you have to nail three variables to make money - direction, magnitude, and time horizon. Also, avoid **2) triple leveraged ETF/ETN.** The volatility and leveraged used in the ETFs will cause a ""decay"" in your return if the market trade sideways. As for ETN, their prices could fall to certain level that trigger ""acceleration event"" in which case, the investment banks issuing the ETNs will redeem the ETNs from you, usually at a steeply discounted price.

***Long term:*** Long equity, with overweight on mid-mega cap tech stocks."
2019-08-15,markyu007,1007,GE shares drop after Madoff whistleblower Harry Markopolos raises red flags on its accounting,[https://cnb.cx/302V29H](https://cnb.cx/302V29H)
2020-03-14,KingMan6969,2,"What is your preferred way to hedge in a bear market? Puts, shorts, or selling off some of your investments?","Say you had 100k in just general S&P 500 fund, and you were feeling strongly that a sustained drop in the market was coming...  If you think the market is heading bear, what is the best way to hedge for this?  Just selling a lot of your fund, and letting the market fall a bit before buying back in?  Put options on $SPY? Short sell $SPY? Buying into an inverse ETF bear fund?

Not looking for ""don't try and time the market"" things, more just I'm curious why someone might prefer one method over the other, and the pros and cons to them."
2020-03-15,Gs05,0,Sell or just wait it out? Sell 20% now to invest later?,"Background
- 125k cash
- 350k in non retirement equities
- 500k in retirement funds

20% bonds, the rest in equity is split evenly between international, small cap, large cap and s&p index funds, with a few one off etfs.


Age 37

Don’t need the money anytime soon, but wondering if I should sell 20%  now as a hedge to invest later?  I would sell those funds in the red to avoid tax bills, but that 20% could be used a month from now if the market tanks further.

Thoughts?  Or should I just leave it alone and wait it out?"
2019-12-19,yinmeio,4,Is there an easy way to invest in a basket of non-US currencies?,"The US dollar value is high, and I'd like to hold a position in a basket of foreign currencies in case the USD drops. Can anyone recommend an ETF or other product for this? It's surprisingly difficult to find answers for this online.

I would just by GLD, but damn those capital gains taxes are high! Thanks friends."
2019-12-24,nathansmith2016,7,Repo markets analysis by Zoltan poszar,"[Credit Suisse Global Money Notes](https://research-doc.credit-suisse.com/docView?language=ENG&format=PDF&document_id=1081995001&source_id=csplusresearch&serialid=3Wu3wFUMyBePtRtdFV1OMaR7niXpesYU5RWs%2BEt8MUj345qGgy0JBraUpL4cB83R&cspId=1767182447312478208)

Anyone have a chance to check out the above article written by one of the founders of the repo market, Zoltan Poszar? Do you guys have any insight into why he might be wrong in his bearishness."
2020-01-06,atlantaoonana,0,What are the benefits of investing on your own vs investing in an S&P500 and is there a danger to the SP 500?,"1) What is the main benefit to investing in personal stock choices vs the sp index? Is it  mainly that someone thinks they can invest better/ have higher returns than SP500 can give them? Is it better to stick to SP 500 for your first few years?

2) How fool proof is SP500? I am looking at market trends and it seems like it averages off at around 8-10 % returns/annually when you look at both the years it went negative and positive? Some people believe in putting 90% into the SP but what about large emergencies? Seems like from 2009-2013 it took 4-5 years to recover. 

3) How badly would SP be affected by a major company at the top of the list tanking? Say facebook went belly up in a few years?"
2020-02-16,wrensalert,8,Looking for an ETF to short the market?,"What’s a popular ETF or fund to get if you think the markets going down or want to hedge? 


Thanks"
2020-03-07,ovideos,1,When (if ever) to sell on a falling market?,"I know, and pretty much 100% believe, the advice that:

1) people who hold statistically do better than people who try to ""time the market"".

2) selling after a big loss is a mistake unless you are in need of cash.

The exceptions to this is, of course, some company that is clearly in a death spiral.  But as long as you're invested in mutual funds/ETFs, it would seem that holding on is better advice.

But I wonder, at some point you may believe the market as a whole is a losing proposition.  Are there any classical signals that people (like hedge/mutual fund managers for instance) would take to mean ""sell even if you're losing because you're only going to lose more""?

I understand that the big error in this thought is the fact that no one ever really knows when bear markets will bounce or dive, but I'm curious to know if anyone disagrees with that common wisdom?

To clarify: I'm not talking about people who pull out at the top and then only have to decide when to buy back in.  I'm talking about people who decide to ""cut their losses"" and when they do it, and how often does it turn out better for them?  That kind of thing."
2020-02-17,roman-roman,1,Dai Savings Rate is at 7.50% APR.,"The Decentralised Finance space is developing and offers some interesting financial instruments. One that particularly caught my attention is Dai Savings Rate (DSR). Dai is a decentralized stablecoin (i.e. 1DAI = $1) built on Ethereum platform (MakerDAO project) with over 100M market cap.

One feature of DAI is the possibility to generate variable yearly interest with no exposure to any (volatile) crypto asset. Current rate at 7.50 APR  makes it a very lucrative investment. Rate can change, but it's not necessary to lock funds for prolonged time - if it gets too low one can simply exchange dai back to fiat currency to invest elsewhere. Many exchanges provide liquid DAI/USD pairs.

While holding DAI doesn't expose investors to the volatility of ""normal"" crypto assets, there are other risks to keep in mind:

* Wallet Management: utilising DSR requires careful management of keys and performing transactions. While it's only a couple of transactions, losing a private key or sending funds to a wrong address can lead to loss of all assets. One should start with smaller amounts first to get comfortable with the system.
* Smart Contract Risk: the system is decentralised, and a bug in the contract can lead to fund loss. However, the MakerDAO smart contracts were audited multiple times and already hold significant amount of funds for prolonged time, making this risk much lower. 
* There might be a bug in Ethereum itself - very unlikely at this point. If desired, it can be hedged with buying Put options on ETH.

source and more info: [https://ethereumprice.org/guides/article/dai-savings-rate-explained/](https://ethereumprice.org/guides/article/dai-savings-rate-explained/), [https://www.reddit.com/r/MakerDAO/comments/f4xijg/should\_i\_put\_100000\_dai\_into\_dai\_savings\_rate/](https://www.reddit.com/r/MakerDAO/comments/f4xijg/should_i_put_100000_dai_into_dai_savings_rate/)"
2019-07-12,rajatajmera10,772,Warren Buffett’s Investment Tips For Beginners,"Warren Buffett is CEO of Berkshire Hathaway, but he bought his first stock when he was just 11.  According to Forbes, Warren Buffett is worth $82.5 billion, making him the third wealthiest individual alive behind his friend and co-founder of Microsoft, Bill Gates, and Jeff Bezos, founder of Amazon.

“When a individual with cash meets an experienced individual, that individual with experience ends up with cash and that individual with cash leaves with experience.“.This was Warren Buffett’s response, when asked about his best investment advice. Warren Buffett says that experience is the ultimate key to be a successful investor.

One of Buffett’s most famous quotes is “Be fearful when others are greedy, and greedy when others are fearful.”

Warren Buffett is considered to be one of the best long-term investor, so it’s no wonder many people like to listen closely to Buffett’s words of wisdom, in order to apply them to their own lives. With that in mind, here are Warren Buffett’s Investment Tips

Warren Buffett’s Investment Tips

Investing is long term Game

Money doesn’t grow overnight, by getting nine women pregnant you can’t make a child in a month. No matter how good the talent or attempts are, Warren Buffett is just saying some things take time.

Investment planning should be done by considering long term goal. Investor goes for futures and options with the hope of making quick money but they are actually the one who loses more money.

Warren Buffett never did trading (Intraday or Positional). Warren Buffett also says “If you aren’t willing to own a stock for 10 years, don’t even think about owning it for ten minutes.”

Diversification isn’t always a good idea

Many good investors says diversification is good idea for investment in stock market. But Warren Buffett tends to disagree with the idea.

Warren Buffett suggests diversification is for individuals who have little knowledge of investment. An experienced investor should select long-term stocks and have confidence in their investments.

“Diversification is a protection against ignorance. It makes very little sense for those who know what they’re doing.” – Warren Buffett

Some investors diversify their portfolios because they are afraid that any one stock might sink their entire portfolio; but, while doing so, it becomes much harder to keep focus on individual investments. They may decrease their portfolio’s volatility by diversifying, but at the same moment decrease their focus on individual investments.

Excessive diversification also means that a portfolio is likely invested in a number of businesses, diluting the impact from its high quality holdings.

“The idea of excessive diversification is madness.” – Charlie Munger

Don’t invest in a company whose business you don’t understand

This is one of the most important Warren Buffett’s Investment Tips. People invest their hard earn money just by hearing something good about the particular company from others. You can determine if there will be any related economic issues in the future by knowing the company. In the stock market, there are many firms whose company can be understood by any ordinary individual. Buffett warns you should never invest in companies you don’t comprehend completely.

Trust yourself to be a successful investor

Warren Buffett says that the hardest thing is to trust your investment decisions. You always think that others are right and you are wrong. Instead, you need to study and believe in yourself.

“I always knew I was going to be reach. I don’t think I doubted for a minute”- Warren Buffett

To be successful, you need to overcome the fear and not pay attention to what others are telling you. Accumulate understanding and create investment choices to stand apart from the crown and be a winner on your own.

Think like an owner

Warren Buffett always says in his interview, you have to thinking like an owner changes your whole views on stock investing.  Warren Buffett says if you are going to own a new car/bike, you will think about its fair valuation, you will think about its features and you will compare it with cars/bike offered by other manufacturers from the same segment. Then you’ll decide which one to purchase after reviewing everything. Similarly, stocks should have the same view.

Prefer quality stocks than cheap stocks

A lot of people buy stocks just because they are cheap without understanding that cheap is not always better. Charlie Munger’s Buffett discovered that “buying a great company at a fair price is far better than buying a fair company at a great cost.” Chances of losing money in cheap stocks are very high compared to investment in a fairly valued stock

There’s no room to be emotional

“Some individuals are not supposed to own stocks at all because they are too annoyed by price changes. If you’re going to do stupid things because your inventory is going down, you shouldn’t own a stock at all, “Warren Buffett said during a cnbc interview. Some people aren’t really mentally or psychologically fit for their own stock, but I believe more of them would be,” Buffett said if they were more informed about what they’re actually purchasing, which is component of a company"
2019-09-23,space_spider,19,Hedging against home price devaluation?,"I'm a noob investor, but I'm about to make a large investment into a single asset (my house), and I'm feeling a little bearish on future home values. Hedging against a downturn would help me sleep a bit better at night. So my plan was to short some REITs. But after pondering it a bit, I'm not sure this will do what I want it to do. What I want is insurance that I can exercise if the value of my house goes down. In the case of stocks, this would be a stock that tracks the value of my house (and only my house) which obviously doesn't exist. In the case of REITs, the managers of the trust will rebalance the portfolio to (attempt to) optimally increase shareholder value. So if I'm shorting REITs, it's not clear to me how much I'm shorting the managers' abilities and how much I'm shorting ""the market"" (in quotes because the definition changes between REITs). Is this the right approach to hedge against home value depreciation? What else can I look at?"
2019-11-14,readwritethink,3,"Renaissance Technologies's fees on their Medallion Fund are 5/44, but it's only for employees. What are the fees on their publicly available funds?",
2019-11-30,rampitup55,0,Would you follow someone's calls if they had a good track record?,"I'd rank my own knowledge of markets and trading as ""medium"". So something I've always wanted to find is someone who makes reliably good calls. And then just do what they do. I'm sure you've seen them around, on Twitter and just about every other platform. Someone who does appear to know what they're doing, and they post up what they think the market (or a certain stock) will do that month. Then their followers choose whether or not they're going to take the risk, and more often than not, the guy was right. 

I'd just like to get your take on these people. Here's a random example from google:

[https://stocksathome.com/](https://stocksathome.com/)

Someone like that. I haven't checked that one out in particular, but I imagine that he's just a good TA guy and knows what he's doing. So would you ever use such a service? Would you ever go by someone else's call, IF that person had a proven track record of getting it right?"
2019-12-10,Kanikamenrider,1,Where to start studying?,"I am interested in creating a passive income, and understand stocks dividends is a good way to build it.
I was  thinking of studying using the series 7 study books, but since I currently know very little about this world, I was wondering if anyone could tell me if this the right direction?

Otherwise what would best way to build a passive income for someone with a strong mathematical background?"
