Date,Name,Score,Title,Content
2019-08-17,TigerKingz,27,For Fun: Who is the secret Hedge Fund backing the GE short ?,"  

Just for Fun I wanted to put his post together (as a speculated guess) to uncover the Hedge fund backing the GE short.

It was recently disclosed that Harry Markopoulos has disclosed a potential accounting fraud in GE. He is backed by an undisclosed Hedge Fund.

I believe this hedge fund to be Pershing Square Capital Management (PSCM) Bill Ackmans fund because;

   
 

1. PSCM recently took a position in Berkshire Hathaway. (one of the biggest; best capitalised and most liquid insurers in America). GE is exact opposite, one of the worst capitalised insurers with little tolerance on the balance sheet for write downs, economic downturns and questions around the capital reserves.

The BRK position would act as the natural hedge to the GE short position.

If not GE what else is the hedge for his Berkshire trade??? PSCM is a hedge fund after all.

   
 

2. PSCM has been hit with reputational damage and regulator issues on the Herbal Life short in a past trade. 

Bill has mentioned in the media that he will be reluctant to approach a stock short in the same manner as Herbal Life due to reputational risk and also the risk that regulators are reluctant to investigate a company as the shorting Hedge Fund profits from the mere appearance of an investigation. 

To mitigate/avoid this risk, Bill has said instead PSCM will disclose in private to the regulator rather than make public disclosure. Markopoulos has said the regulator was informed before the August public disclosure.

   
 

3. Where is Bill Ackman? 

Normally Bill is in the media discussing/detailing the PSCM new positions. 

Also, in my opinion, Bill would likely oblige the media by publicly disclosing to the market that PSCM is not the Hedge fund shorting the GE stock, given point 2 above.

Bill's absence from the media is quite telling me.

Using Markopoulos to publicly disclose the trade is a shrewd/novel way of getting around this. 

   
 

4. Why would a Hedge Fund care if their publicly short a beaten up stock like GE?

Isn't the point of Hedge Funds to be long and short stocks and be market neutral - see point 2.

(I will defer that regulator issues may be one).

   
 

I did think the PSCM was the most likely from T+6hrs from the first disclosure so I may have had inbuilt bias. But we will see. This is just for fun with bit of logic and public knowledge, no more than Markopoulos has done for his research. 

(It really doesn’t matter who the Hedge Fund is)

   
 

Let’s hear your ideas or criticize my points."
2020-03-21,bunkerhunt,37,Repo Crisis appears to be bailout of over-leveraged hedge funds,[https://www.zerohedge.com/markets/confirmed-fed-bailed-out-hedge-funds-facing-basis-trade-disaster](https://www.zerohedge.com/markets/confirmed-fed-bailed-out-hedge-funds-facing-basis-trade-disaster)
2020-03-19,ltdshred,19,Bridgewater hedge funds fall further on coronavirus market rout,"https://www.reuters.com/article/us-health-coronavirus-bridgewater-idUSKBN21539W

(Reuters) - Bridgewater Associates LP, the Ray Dalio-led hedge fund giant famous for making money during the 2008 financial crisis, has posted double-digit losses so far this year amid sharp market declines sparked by the coronavirus outbreak, according to a note sent to clients on Wednesday and seen by Reuters. 

Through March 16, Bridgewater’s All Weather 12% volatility “risk parity” fund fell about 14% for the year; its Pure Alpha 18% volatility hedge fund declined about 21%; and its Major Markets 14% volatility hedge fund dropped about 7%, Dalio wrote. 
Dalio wrote that the performance was “not what I would want” but was “consistent with what I would have expected under the circumstances.” 
Bridgewater has assets under management of about $160 billion, according to its website, and is trusted by some of the world’s largest investors to safeguard their money no matter the economic environment. 
The S&P 500 index tumbled 7% on Wednesday, triggering a 15-minute trading halt of Wall Street’s main indexes for the second time this week, on fears that stimulus measures may not be enough to avert a coronavirus-driven recession. 

Dalio said Bridgewater’s portfolios were positioned for relative economic strength but also had hedges on in case of an unanticipated steep market decline. The firm’s risk controls worked as designed, he said, adding that Bridgewater remained liquid and able to adjust its positions. 
“Going forward, the world has now crossed a very dangerous threshold for financial markets and economies that poses great risks for all investors,” Dalio wrote, citing interest rates falling below zero percent amid an economic downturn, inequality and populism. 

“It is one we have been preparing for for a long time.” 

CHINA RUMORS 
On Wednesday, Dalio posted on popular Chinese microblogging site Weibo to dispel rumors about a Bridgewater blow-up. 

“There has been a rumor going around China that Bridgewater has ‘crashed’ or ‘is in trouble,’ Dalio wrote, attaching the client note with the firm’s performance and views. “You have my word that that is totally false and that Bridgewater is totally safe.” 
He condemned “bad people” who spread such rumors. “I think we might have identified the rumor monger which we will pursue legally and disclose publicly if we are able.”"
2020-03-07,ThinkBigger01,4,What software do hedge funds and professionals like Ray Dalio use?,"Does anybody know what software(s) for trading and stock analysis is being used by the big professionals and hedge fund managers like Ray Dalio, etc..? 

Also, which brokers do they use for making their high volume trades?"
2020-03-19,yoloh,12,"Social Capital CEO Chamath Palihapitiya interview on CNBC - Great discussion of current market issues - covid-19 testing, leverage, buybacks, hedge fund 10x+ leverage exacerbating market volatility, bailouts","Discussion of buybacks and hedge fund leverage begins around 8 minute mark.  


Link - [https://youtu.be/NvEWez59fbI](https://youtu.be/NvEWez59fbI)"
2020-02-22,KtoMM199,0,"Can you ""learn investing"" in 3-5 years enough to start a hedge fund?","Please read before answer.

&#x200B;

**YES.** I understand that some people can and some people can not. I am just asking if it is decently possible.

Learn would consist of

1. Reading books/Investopedia/Websites/Finance news/etc...
2. Taking small amounts of money and investing, elarning, and investing more"
2020-03-02,PersonalHarp461,0,If you work at a hedge fund do you get a percentage of what you make?,
2020-03-19,yoloh,7,Hedge Fund Leverage - Is it driving extreme volatility by exacerbating market conditions? Are they really levered 10x+ !?,"Some related news:

\-CNBC Interview - [https://youtu.be/NvEWez59fbI](https://youtu.be/NvEWez59fbI) (8 minute mark)

\-FT Article - [https://www.ft.com/content/a088f51c-69e2-11ea-800d-da70cff6e4d3](https://www.ft.com/content/a088f51c-69e2-11ea-800d-da70cff6e4d3)"
2020-03-01,marabou_stork,0,Open source hedge fund?,"I've been trading stocks for the past \~10 years and have been doing pretty OK so far. I've spent the past \~2 years formalizing my investing into a formal playbook, and also moving from ""buy and hold"" strategies to more complex things like hedging with put options or increasing my exposure with call options.  


I bring this up because I'm curious -- have you seen any hedge funds that trade ""publicly"" where they actually make their investment committee decisions public? i.e., if they choose to buy an equity, they describe why and what they expect (so they can test against it), or if they decide NOT to invest, they also list this out?  


I guess it's similar to investor letters, but would be more ""open source"" in providing information on how they make decisions and why. I'm (partly) debating whether such a fund would be ""interesting"" to start."
2020-03-09,programmingguy,8,"Which ""hedge"" funds are going bust during this time?",Any little birdies out there? Expecting to see some James Cordier type blow ups. Wife's friend's husband's investment management firm will be announcing a bunch of layoffs.
2020-02-04,KtoMM199,0,"I want to, one day, start a hedge fund, what do I need to learn to do?","I know this may seem dumb but I am willing to put the hard work in and if at any point it turns out I do not like the work, I will just quit, so no point in not trying

1. What kind of job do I need to get to learn the skills?
2. What do i need to do in my free time to learn?
3. I know hedge fund takes money from investors for, ideally me, to invest in the the stock market and other places to grow it as much as possible
4. Any more advice?"
2020-01-25,thunderking500,5,I have heard people say Rennaissance is the greatest hedge fund of all time,"do you agree with that, under any metric?"
2020-02-07,KtoMM199,0,Will working as an Economic/Management Consultant prepare me to start a hedge fund?,I know the best way to get the experience is to work in a Hedge Fund or IB but would Econ/Management Consulting provide me similar knowledge?
2020-03-12,flatchampagne,0,Hedge fund Solus to close flagship investment vehicle - FT,"https://www.ft.com/content/da193096-63af-11ea-b3f3-fe4680ea68b5?shareType=nongift 

Article behind paywall so here you go:

Solus Alternative Asset Management, one of the best known specialists in distressed investments, is closing its flagship fund after suffering a combination of heavy redemptions and poor performance.

The hedge fund, which as recently as November managed $4.3bn in assets, is one of the first casualties of a collapse in the price of riskier assets this week. In a letter to investors in its Sola vehicle on Tuesday, the firm offered them the option to transfer their investments into new funds or face “an orderly liquidation” that would return their funds “as soon as practicable”.

“Due to the evolving state of the markets, this has left our flagship fund Sola with a high concentration of less liquid assets,” the letter said.


The Financial Times reported in December that Sola had suffered big losses after making a number of ill-fated bets on companies including satellite operator Intelsat and Pacific Gas and Electric. The fund finished the year down more than 8 per cent, after a 15 per cent drop in 2018. It had assets of about $4bn at the turn of the year.

Solus’s letter to investors said that “unexpected withdrawal requests” had followed reports of the firm’s difficulties in the financial press.

The company declined to comment.

Solus emerged as one of the most high-profile distressed investment firms in the US after its skirmish with Toys R Us employees in 2018 and a legal battle over derivatives with a Blackstone-owned hedge fund, GSO Capital Partners.

Now, though, it has become a victim of a string of corporate collapses that have tripped up US distressed investment funds, which look to profit from buying stocks and bonds of struggling companies at bargain prices.

Shares in Intelsat, a heavily indebted satellite group popular with hedge funds, collapsed as much as 75 per cent in November after a US regulator rejected its plans to raise money by selling off its airwaves. Some of the company’s bonds are now trading at about one-third of face value, as bondholders are braced for a potential wipeout.

Shares in two of Solus’s other equity investments, US coalminer Contura Energy and offshore drilling services group Hornbeck, both dropped about 90 per cent last year.

An investor report from January showed that 22 per cent of Sola’s exposure was to “energy equipment and services” companies: a sector that has been hit by a growing distaste among investors towards fossil fuels and, more recently, a sharp fall in the oil price.

Many other distressed specialists are smarting from bets on energy-related companies turning sour. Blackstone’s GSO faced ruptures in its distressed investment unit last year, for example, due in part to bad bets on ailing oil and gas groups, such as Oklahoma-based Tapstone Energy.

Investors who stick with Solus face two options.

They can switch over to what the firm calls a “long-term opportunities” fund that looks to invest in thinly traded assets. Alternatively, they can lock up their investments until 2021, by which time Solus will sell its illiquid holdings and reinvest the proceeds in more easily tradeable assets."
2020-01-21,Randomacct7652,0,The real shocker here seems to be the average hedge fund does worse than a CD at delivering returns,"Unless I’m reading this wrong (and I am open to correction), it seems like the average hedge fund did a bit better than 1% a year. Like why is anyone trusting them with their money?

EDIT: I am getting the “slightly better than 1% number” from the average 3-year returns of the index are 3.9%. Which I am interpreting as 3.9%/3=1.3%

[Article on diverse teams in hedge funds](https://www.bloomberg.com/news/articles/2020-01-21/hedge-funds-not-led-by-white-men-outperform-peers-nearly-2-to-1)"
2020-01-01,CautiousInvestor,13,Hedge-Fund Purge Deepens as $3 Trillion Market Retrenches.,"2019 marks the 5th straight year of negative net openings - i.e. more hedge-funds closed than opened. It's the 2nd worst year of this streak: net openings were -149, vs -328 in the worst year, 2016. Overall, more than hedge-funds 4,000 died during this streak.

The S&P 500 performed exceptionally well, delivering a 28% gain this year through November, while hedge-fund returns were poor, with the Bloomberg Equity Hedge Fund Index at only 10%. These are poor returns in an absolute sense, not just compared to S&P performance. In other words, even if S&P performance was average, these would be poor returns considering the high management fees charged by hedge-funds. January through November 2019 saw a total flow of $81.5 out of hedge-funds.

The article contains a list of notable hedge-funds that shut down this year. You'll notice some pretty well-known names in that list, including a Citadel fund:

https://www.bloomberg.com/news/articles/2019-12-30/hedge-fund-purge-deepens-as-3-trillion-market-retrenches"
2019-12-26,im_vitas,24,The top 30 held companies by hedge funds vs S&P 500 over 5 years and 1 Year,"Very crude sheet I just made but I thought I would share. Please note some companies haven’t been public for 5 years

Sidenote: to purchase 1 of each of these 30 stocks would cost 11,470.50 today

https://imgur.com/gallery/5JIY43n"
2019-11-22,WentBrokeDec2018,53,Ray Dalio denies report hedge fund Bridgewater has bearish bet on market,https://www.reuters.com/article/bridgewater-associates-markets/update-1-ray-dalio-denies-report-hedge-fund-bridgewater-has-bearish-bet-on-market-idUSL3N2823FR
2019-12-21,grammerknewzi,7,Hedge funds,Does a person with a heavy macro perspective of investing have a opportunity in hedge fund work? Or is quant and ai trading now a necessity at such places? What about for equity research and asset management.
2019-12-11,KtoMM199,0,ELI5: Hedge Funds (I have some questions),"1. Who owns a hedge fund?
   1. Lets say I start a hedge fund and then 10 investors give me their money to manage and grow, do they get equity in my company? Or am I just like a bank except I asctually make decisions with the money like investing in stocks etc...?
2. How does a Hedge Fund grow someones money? What do they do with it?
3. What makes a great hedge fund manage in growing someone's money?
   1. Ability to know what stocks to buy? Knowing what companies to invest in?"
2019-11-28,rtkn345464345234m,0,Are mutual funds and hedge funds able to take advantage of zero commissions?,
2019-11-19,brildenlanch,0,Quick question about how hedge fund investments work,"Set to make it easy say the hedge fund has $9,000 and I invest $1,000. That gives me 10% total stake. Do I get 10% of all profits, or is it always relative to my initial investment. So say the Fund is worth 20 grand at the end of the year. Am I getting 10% of that, or is my 1000 refigured as a percentage of the 20 grand and I get profits based on that?

And if I wanted I could just reinvest my profits back into the fund, right?"
2020-01-10,cheedowngo,1,Aramark tapped a new finance chief following an investment by hedge fund Mantle Ridge LP,"[Aramark tapped a new finance chief  following an investment by hedge fund Mantle Ridge LP](https://www.wsj.com/articles/aramarks-new-cfo-to-help-shift-focus-toward-revenue-growth-11578355375)

Aramark announced the move before regular trading on the New York Stock Exchange. Aramark shares rose 1.87% to $44.08 on Monday."
2020-03-13,RaMHEaT,0,Leveraged Inversed Cad Hedged fund,"Does anyone know anyone knows any inversed leveraged index fund? Ideally listed on the TSX, don't want to bother with the whole USD/CAD exchange rates."
2019-10-15,RosmarysBabyBjorn,10,To what extent are asset prices skewed by risk and return rules at large institutions like pension funds and hedge funds?,"Sometimes I hear about rules like that pension funds have to hit certain return targets or conversely that they have to hold a certain portion of their portfolio in safe investments such as government bonds. To what extent does this affect asset prices? Could this dynamic forestall or accelerate recessions? For example, since government debt today has relatively low yields, could large institutions be forced by their return targets to move into stocks even if they think/know the stocks are overpriced? Is this part of why stocks can be hitting record highs even as the bond market is predicting a recession?"
2019-10-16,Lyman-Zerga,33,Hedge Fund Letters Q3 2019,[Hedge Fund Letters](https://miltonfmr.com/hedge-fund-letters/)
2019-08-14,WePublican,15,Why aren't long-short hedge fund strategies available to the masses?,ETF strategies about and there is NO real differentiation between what Motif offers to what Acorns or Betterment or WealthSimple offers. All are ETF based investments with a direct correlation to the markets. Markets crash and these guys will suffer since they don't really have a hedging strategy. So why are't hedge fund long short strategies available to us all? Messed up no?
2019-08-08,ThinkBigger01,15,"Why do most long/short hedge funds use ""130/30"" strategy and not 150/50 or other ratio?","When reading about long/short hedge funds, apparently alot use a 130/30 strategy, meaning they first invest 100% long, then borrow and short-sell 30% and use the money to invest an additional 30% on the long side.

I get that, but who decided this has to be 130/30 and not for example 150/50 long/short or some other ratio? Why the popularity of 130% long 30% short?"
2019-11-29,researchmind,4,Hedge funds control 35-45% of Osram shares in headache for suitor AMS: source," 

MUNICH (Reuters) - Hedge funds control 35-45% of the shares of German lighting group Osram ([OSRn.DE](https://www.reuters.com/companies/OSRn.DE)), posing a headache for Austrian suitor AMS ([AMS.VI](https://www.reuters.com/companies/AMS.VI)) as the investors may press for the $5 billion offer to be sweetened, a person close to the matter said on Thursday.

FILE PHOTO: The logo of German lighting manufacturer Osram is illuminated at the company's headquarters in Munich, Germany, September 16, 2019. REUTERS/Andreas Gebert/File Photo

An initial bid by AMS to create a global leader in sensors and lights stumbled last month when it fell short of the necessary shareholder backing. Since then AMS has lowered the acceptance threshold to 55% to try to get the deal over the line, while keeping the offer price at 41 euros a share.

Osram Chief Executive Olaf Berlien told German daily Sueddeutsche Zeitung that some investors seem to have no intention of tendering their shares by the Dec. 5 deadline.

“It appears that a number of hedge funds have acquired shares with the aim of selling them at a later date and at a higher price,” he told the newspaper, which first reported the stakes held by hedge funds.

German law allows for courts to determine that minority investors be compensated at a higher price for their shares when an acquirer and a target company strike a so-called domination agreement, which regularly prompts hedge funds to hold back shares aiming to benefit from a deferred sale.

However, if too many speculative investors decide to hold back shares that can lead to deals falling apart, as seen in initial failed attempts for a leveraged buyout of generics firm Stada. That deal eventually went through in 2017 after the offer price was bumped up.

AMS - which already controls 20% of Osram - said on Wednesday that 3.3% of Osram shares have been tendered so far.

On Oct 31, hedge fund Sand Grove Capital Management disclosed a 5.75% Osram stake.

Around 10% of Osram shares are held by exchange-traded funds, which according to German law, are not allowed to sell their stake as long as the takeover is not completed, banking sources have said.

Retail investors, which often ignore tender offers, hold 20%-25%, the sources have said."
2019-10-04,hex72,6,Hedge-Fund Style Investment Reading Recommendations?,"There seem to be plenty of books around on traditional value style investing (securities analysis, intelligent investor, margin of safety etc.). But I’m very interested in learning more about short term investing, specifically thinking like a L/S hedge fund would. Have you guys got any reading along those lines?

Edit: L/S Equity was what I was thinking about"
2019-10-14,BkkReady,0,Are hedge funds only viable for wealthy investors?,"I know some require large minimums but if you're able to find one with lower requirements, does it make sense to consider it as an option?"
2019-09-21,WhoresAndCocaine,0,"Is it possible to create a small hedge fund for non wealthy and sophisticated investors, such as 10 friends?","Pretend that I have a “can’t miss” investment strategy that will destroy the S&P 500 over the next 30 years.  Call me lil-buffet.

And lets say that I want to hook up friends so they can come along for the ride.  My initial investment would be 100k for myself, and since I’m such a great guy I would give 10k to 10 friends so they could invest that in my fund.  So the fund would start with 200k with 20 shares and I’d be in charge of all investment decisions.  I would also want to keep the expenses as low as possible so no 2-20 type of fees, but something like \*actual\* fees per share .

Is there a name for such a model?  It’s close to a hedge fund, but hedge fund participants usually have to be filthy rich and ”sophisticated“.  My members wouldn’t be anything of the sort.  They can put in 10k and not a cent more.  They can withdraw anytime they want, but if they do, they divest the entirety of their single share.

Ok, I obviously don’t have such a strategy nor am that great of a guy to give away 100k.  But just for shits and giggles, suppose I did.  How would one set up such a “fund” without running afoul of the law?"
2019-09-15,fruitydollers69,0,"Just calculated my ""alpha: 5.7%"". I should be a hedge fund manager!","**Edit**: Wait, I messed up and misread my own spreadsheet. My alfalfa is actually 7.02%! Wall street here I come!

**Edit 2**: And my Sharpe ratio is 4.2. betttttt

I just used excel to calculate my alpha (or in other words, the *risk-adjusted* amount by which I am ""beating the market""). 

It's 5.7%, because I returned 12.7% while the S&P 500 returned 5.15% (from the end of March 2018 to now), and the beta of my portfolio was 1.19 (my portfolio was a little more volatile/risky than the market, but the better returns made up for that). 

Just thought this was cool! Has anybody else tried to do this for their own portfolio?"
2019-08-08,thatsmyasset,9,Why has it been so hard for new Hedge Funds to raise money in 2019?," Only one new hedge fund has managed to reach $2b this year, $6b shy of last year’s highest total.

 [https://www.alternativesoft.com/why-has-it-been-harder-for-hedge-fund-start-ups-to-raise-money.html](https://www.alternativesoft.com/why-has-it-been-harder-for-hedge-fund-start-ups-to-raise-money.html)"
2019-10-05,itsberto,0,HEDGE FUNDS BUYING SFR,"Hello everyone,

I am a real estate investor in Atlanta, GA. I consistently get deals 60-70% market value. I have heard that hedge funds acquire single family properties for their portfolios. Is this true? How do they make this work for their investors this way? I want to understand it, so I can network and find a way to get my deals to them. 

Thanks"
2019-08-24,bb7u8b7b7,1,Why do Hedge Funds have a limit of 99 investors?,
2019-04-18,Pleather_Boots,30,How are hedge fund managers so insanely rich?,"I was looking at a list of the richest people in NYC.

Most of the list was hedge fund managers. Each was worth multiple billions of dollars.

This might be a dumb question, but how do they accumulate that much wealth? Is it commissions on the money they make for people?

Are the commissions huge?  Or they just manage so much money that it adds up?  


I get that it's lucrative, but the earnings seem so out line vs other professions - like a law firm partner or hell, even Jack Bogle didn't make it to 1 billion.  I can't image what it takes to accumulate multiple billions of dollars that way."
2019-04-05,EmployerOfTheMonth,63,"The Hedge Fund ""Lone Pine"" has averaged 30% annualized returns since 1997. To put that into context Buffet has managed 21%",https://www.forbes.com/sites/greatspeculations/2014/12/16/perhaps-the-best-billionaire-investor-youve-never-heard-of/#5b57d33c47ea
